{
  "name": "hbf-stage3-16k-two-module-link-fixture",
  "version": 1,
  "ucie_format": 6,
  "aou_hbf_profile_id": 1,
  "aou_hbf_revision": 0,
  "aou_hbf_option": 0,
  "lanes": 64,
  "gt_per_second": 16,
  "axi_ports": 1,
  "local_capacity_bytes": 8388608,
  "scenario_assumption": {
    "initial_ar_granules": 12,
    "initial_r_granules": 56,
    "max_accepted": 128,
    "propagation_ns": 1
  }
}
